Enter password: *************
Welcome to the MySQL monitor.  Commands end with ; or \g.
Your MySQL connection id is 43
Server version: 8.0.32 MySQL Community Server - GPL

Copyright (c) 2000, 2023, Oracle and/or its affiliates.

Oracle is a registered trademark of Oracle Corporation and/or its
affiliates. Other names may be trademarks of their respective
owners.

Type 'help;' or '\h' for help. Type '\c' to clear the current input statement.




mysql> show databases;
+--------------------+
| Database           |
+--------------------+
| addressbook1       |
| information_schema |
| payrollservice     |
| Demo               |
| Rfp255             |
| sakila             |
| sys                |
| test               |
+--------------------+
10 rows in set (0.03 sec)

mysql> use payrollservice
Database changed
mysql> insert into employee_payroll( employee_id,name,salary,start_date) VALUES (1,'Rohith',35000,'2019-04-15'),(2,'Shoban',48000,'2020-12-09'),(3,'Rahul',5600,'2022-04-25');
Query OK, 3 rows affected (0.01 sec)
Records: 3  Duplicates: 0  Warnings: 0

mysql> select * from employee_payroll;
+-------------+---------+----------+------------+
| employee_id | name    | salary   | start_date |
+-------------+---------+----------+------------+
|           1 | rohith  | 35000.00 | 2019-04-15 |
|           2 | shoban  | 48000.00 | 2020-12-09 |
|           3 | rahul   |  5600.00 | 2022-04-25 |
+-------------+---------+----------+------------+
3 rows in set (0.00 sec)

mysql> select salary from employee_payroll where name='Shoban';
+----------+
| salary   |
+----------+
| 48000.00 |
+----------+
1 row in set (0.00 sec)

mysql> select * from employee_payroll WHERE start_date BETWEEN CAST('2019-04-15' AS DATE) AND DATE (NOW());
+-------------+---------+----------+------------+
| employee_id | name    | salary   | start_date |
+-------------+---------+----------+------------+
|           1 | rohith  | 35000.00 | 2019-04-15 |
|           2 | shoban  | 48000.00 | 2020-12-09 |
|           3 | rahul   |  5600.00 | 2022-04-25 |
+-------------+---------+----------+------------+
3 rows in set (0.01 sec)

mysql> alter table employee_payroll add gender varchar(5);
Query OK, 0 rows affected (0.11 sec)
Records: 0  Duplicates: 0  Warnings: 0

mysql> select * from employee_payroll;
+-------------+---------+----------+------------+--------+
| employee_id | name    | salary   | start_date | gender |
+-------------+---------+----------+------------+--------+
|           1 | rohith  | 35000.00 | 2019-04-15 | NULL   |
|           2 | shoban  | 48000.00 | 2020-12-09 | NULL   |
|           3 | rahul   |  5600.00 | 2022-04-25 | NULL   |
+-------------+---------+----------+------------+--------+
3 rows in set (0.00 sec)

mysql> update employee_payroll set gender = 'M' WHERE name = 'rohith' or name = 'shoban' or name = 'rahul';
Query OK, 3 rows affected (0.01 sec)
Rows matched: 3 Changed: 3  Warnings: 0

mysql> select * from employee_payroll;
+-------------+---------+----------+------------+--------+
| employee_id | name    | salary   | start_date | gender |
+-------------+---------+----------+------------+--------+
|           1 | rohith  | 35000.00 | 2019-04-15 | M      |
|           2 | shoban  | 48000.00 | 2020-12-09 | M      |
|           3 | rahul   |  5600.00 | 2022-04-25 | M      |
+-------------+---------+----------+------------+--------+
3 rows in set (0.00 sec)

mysql>